code;parent;fr;nl;de;alt_fr;alt_nl;alt_de;start;end;exactmatch1
006;;Société coopérative à responsabilité illimitée;Coöperatieve vennootschap met onbeperkte aansprakelijkheid;Genossenschaft mit unbeschränkter Haftung;SCRI;CVOA;Gen.mubH;01/01/1800;31/12/9999;http://vocab.belgif.be/auth/orgtype/cbe2003/006
007;;Société coopérative à responsabilité illimitée et solidaire, société coopérative de participation;Coöperatieve vennootschap met onbeperkte aansprakelijkheid, bij wijze van deelneming;Genossenschaft mit unbeschränkter gesamtschuldnerischer Haftung, Genossenschaft auf Beteiligung;SCRISCP;CVOACD;GugsHGB;01/01/1800;01/07/1996;
008;;Société coopérative à responsabilité limitée;Coöperatieve vennootschap met beperkte aansprakelijkheid;Genossenschaft mit beschränkter Haftung;SCRL;CVBA;Gen.mbH;01/01/1800;31/12/9999;http://vocab.belgif.be/auth/orgtype/cbe2003/008
009;;Société coopérative à responsabilité limitée, coopérative de participation;Coöperatieve vennootschap met beperkte aansprakelijkheid, bij wijze van deelneming;Genossenschaft mit beschränkter Haftung, Genossenschaft auf Beteiligung;SCRL CP;CVBA CD;GbHGB;01/01/1800;01/07/1996;
010;;Société privée à responsabilité limitée unipersonnelle;Eenpersoons BVBA;Privatgesellschaft mit beschränkter Haftung mit einem Alleingesellschafter;SPRLU;EBVBA;PGmbHmA;01/01/1800;01/07/2003;
011;;Société en nom collectif;Vennootschap onder firma;Offene Handelsgesellschaft;SNC;V.O.F.;OHG;01/01/1800;31/12/9999;http://vocab.belgif.be/auth/orgtype/cbe2003/011
012;;Société en commandite simple;Gewone commanditaire vennootschap;Einfache Kommanditgesellschaft;SCS;Comm.V;EKG;01/01/1800;31/12/9999;http://vocab.belgif.be/auth/orgtype/cbe2003/012
013;;Société en commandite par actions;Commanditaire vennootschap op aandelen;Kommanditgesellschaft auf Aktien;SCA;Comm.VA;KGaA;01/01/1800;31/12/9999;http://vocab.belgif.be/auth/orgtype/cbe2003/013
014;;Société anonyme;Naamloze vennootschap;Aktiengesellschaft;SA;NV;AG;01/01/1800;31/12/9999;http://vocab.belgif.be/auth/orgtype/cbe2003/014
015;;Société privée à responsabilité limitée;Besloten vennootschap met beperkte aansprakelijkheid;Privatgesellschaft mit beschränkter Haftung;SPRL;BVBA;PGmbH;01/01/1800;31/12/9999;http://vocab.belgif.be/auth/orgtype/cbe2003/015
016;;Société coopérative (ancien statut);Coöperatieve vennootschap (oud statuut);Genossenschaft (früheres Statut);SC (AS);CV;Gen.;01/01/1800;30/10/1993;
017;;Association sans but lucratif;Vereniging zonder winstoogmerk;Vereinigung ohne Gewinnerzielungsabsicht;ASBL;VZW;VoG;01/01/1800;31/12/9999;http://vocab.belgif.be/auth/orgtype/cbe2003/017
018;;Etablissement d'utilité publique;Instelling van openbaar nut;Gemeinnützige Einrichtung;EtUtPub;Inst OpN;GemEinri;11/01/1800;30/06/2003;
019;;Mutualité / Société Mutualiste / Union nationale de mutualités;Ziekenfonds / Maatschappij van onderlinge bijstand / Landsbond van ziekenfondsen;Krankenkasse / Gesellschaft auf Gegenseitigkeit / Krankenkassenlandesverband;MUTU;ZIEK F;Kankenka;01/01/1800;31/12/9999;http://vocab.belgif.be/auth/orgtype/cbe2003/019
020;;Union professionnelle;Beroepsvereniging;Berufsvereinigung;UP;BV;BV;01/01/1800;31/12/9999;http://vocab.belgif.be/auth/orgtype/cbe2003/020
021;;Association d'assurances mutuelles / Caisse commune d'assurances de droit privé;Onderlinge verzekeringsvereniging / Gemeenschappelijke verzekeringskas van privaat recht;Versicherungsvereinigung auf Gegenseitigkeit / Privatrechtliche Versicherungsgesellschaft;AAM;OVV;PRVGaG;01/01/1800;31/12/9999;http://vocab.belgif.be/auth/orgtype/cbe2003/021
022;;Organisation scientifique internationale de droit belge;Internationale wetenschappelijke organisatie van Belgisch recht;Internationale wissenschaftliche Organisation belgischen Rechts;OSI DB;IWO BR;IWObR;01/01/1800;23/04/2004;http://vocab.belgif.be/auth/orgtype/cbe2003/022
023;;Associations étrangères privées avec établissement, agence, bureau, succursale en Belgique;Buitenlandse privaatrechtelijke verenigingen met vestiging, agentschap, kantoor of bijhuis in België;Privatrechtliche ausländische Vereinigungen mit Niederlassung, Geschäftsstelle, Büro oder Zweigstelle in Belgien;AEP;BPR;PRaV;01/01/1800;31/12/9999;http://vocab.belgif.be/auth/orgtype/cbe2003/023
025;;Société agricole;Landbouwvennootschap;Landwirtschaftliche Gesellschaft;S. Agr.;LV;LG;01/01/1800;31/12/9999;http://vocab.belgif.be/auth/orgtype/cbe2003/025
026;;Fondation privée;Private stichting;Privatstiftung;FONDPRIV;PRIV ST.;PrSt;02/05/2002;31/12/9999;http://vocab.belgif.be/auth/orgtype/cbe2003/026
028;;Institution sans but lucratif;Instelling zonder winstoogmerk;Einrichtung ohne Gewinnerzielungsabsicht;ISBL;IZW;EoG;04/04/2003;31/12/9999;http://vocab.belgif.be/auth/orgtype/cbe2003/028
030;;Entreprise étrangère;Buitenlandse onderneming;Ausländische Gesellschaft;ENT E;BO;AGes.;01/01/1800;31/12/9999;http://vocab.belgif.be/auth/orgtype/cbe2003/030
040;;Société congolaise (loi de 1927);Kongolese vennootschap;Kongolesische Gesellschaft;SOC CONG;KONG VEN;K.G.;01/01/1800;01/07/2003;
051;;Autre forme de droit privé avec personnalité juridique;Andere privaatrechtelijke vorm met rechtspersoonlijkheid;Andere privatrechtliche Rechtsform mit Rechtspersönlichkeit;FDP PJ;PRV;PRRFmRP;01/01/1800;31/12/9999;http://vocab.belgif.be/auth/orgtype/cbe2003/051
060;;Groupement d'intérêt économique;Economisch samenwerkingsverband ;Wirtschaftliche Interessenvereinigung;GIE;ESV;WIV;01/01/1800;31/12/9999;http://vocab.belgif.be/auth/orgtype/cbe2003/060
065;;Groupement européen d'intérêt économique;Europees economisch samenwerkingsverband;Europäische wirtschaftliche Interessenvereinigung;GEIE;EESV;EWIV;01/01/1800;31/12/9999;http://vocab.belgif.be/auth/orgtype/cbe2003/065
070;;Association des copropriétaires;Vereniging van mede-eigenaars;Miteigentümervereinigung;ACP;VME;MEV;01/01/1800;31/12/9999;http://vocab.belgif.be/auth/orgtype/cbe2003/070
106;;Société coopérative à responsabilité illimitée de droit public;Coöperatieve vennootschap met onbeperkte aansprakelijkheid van publiek recht;Öffentlich-rechtliche Genossenschaft mit unbeschränkter Haftung;SCRI DPU;CVOA PR;ÖffrGmuH;01/01/1800;01/07/1996;
107;;Coopérative à responsabilité illimitée, coopérative de participation, de droit public;Coöperatieve vennootschap met onbeperkte aansprakelijkheid, bij wijze van deelneming van publiek recht;Öffentlich-rechtliche Genossenschaft mit unbeschränkter Haftung, Genossenschaft auf Beteiligung;SCRI CP;CVOA CD;GmuHGB;01/01/1800;31/12/9999;http://vocab.belgif.be/auth/orgtype/cbe2003/107
108;;Société coopérative à responsabilité limitée de droit public;Coöperatieve vennootschap met beperkte aansprakelijkheid van publiek recht;Öffentlich-rechtliche Genossenschaft mit beschränkter Haftung;SCRL DPU;CVBA PR;ÖfrGmbH;01/01/1800;31/12/9999;http://vocab.belgif.be/auth/orgtype/cbe2003/108
109;;Société coopérative à responsabilité limitée, coopérative de participation, de droit public;Coöperatieve vennootschap met beperkte aansprakelijkheid, bij wijze van deelneming, van publiek recht;Öffentlich-rechtliche Genossenschaft mit beschränkter Haftung, Genossenschaft auf Beteiligung;SCRL CP;CVBA CD;GbHGB;01/01/1800;01/07/1996;
110;;État, Province, Région, Communauté;Rijk, Provincie, Gewest, Gemeenschap;Staat, Provinz, Region, Gemeinschaft;EPRC;RPGG;SPRG;01/01/1800;30/06/2003;
114;;Société anonyme de droit public;Naamloze vennootschap van publiek recht;Öffentlich-rechtliche Aktiengesellschaft;SA DPU;NV PR;Ö.-r.AG;01/01/1800;31/12/9999;http://vocab.belgif.be/auth/orgtype/cbe2003/114
116;;Société coopérative de droit public (ancien statut);Coöperatieve vennootschap van publiek recht (oud statuut);Öffentlich-rechtliche Genossenschaft (frühere Rechtsform);SC DPU;CV PR;ÖfrGfrü;01/01/1800;30/10/1993;
117;;Association sans but lucratif de droit public;Vereniging zonder winstoogmerk van publiek recht;Öffentlich-rechtliche Vereinigung ohne Gewinnerzielungsabsicht;ASBL DPU;VZW PR;ÖrVohGza;01/01/1800;31/12/9999;http://vocab.belgif.be/auth/orgtype/cbe2003/117
121;;Association d'assurances mutuelles de droit public;Onderlinge verzekeringsvereniging van publiek recht;Öffentlich-rechtliche Versicherungsvereinigung auf Gegenseitigkeit;SAM DPU;OVV PR;ÖrVgGe;01/01/1800;31/12/9999;http://vocab.belgif.be/auth/orgtype/cbe2003/121
123;;Corporation professionnelle / Ordre;Beroepsvereniging / Orde;Berufsverband / Kammer;CP ORDRE;BV ORDEN;Ber-Kam;01/01/1800;30/06/2003;
124;;Etablissement public;Openbare instelling;Öffentliche Einrichtung;ETSPUBLI;OI;ÖE;01/01/1800;31/12/9999;http://vocab.belgif.be/auth/orgtype/cbe2003/124
125;;Association internationale sans but lucratif;Internationale vereniging zonder winstoogmerk;Internationale Vereinigung ohne Gewinnerzielungsabsicht;AISBL;IVZW;IVoG;01/01/1800;31/12/9999;http://vocab.belgif.be/auth/orgtype/cbe2003/125
127;;Monts-de-Piété;Berg van Barmhartigheid;Pfandleihhaus;PIETE;BVB;LH;01/01/1800;31/12/9999;http://vocab.belgif.be/auth/orgtype/cbe2003/127
128;;Temporel des cultes / Établissement cultuel public;Eredienst;Kult;TEMPCULT;EREDIENS;K;01/01/1800;30/06/2003;
129;;Polder / wateringue;Polder / Watering;Entwässerungsgenossenschaft / Bewässerungsgenossenschaft;PW;PW;Ewg-Bwg;01/01/1800;31/12/9999;http://vocab.belgif.be/auth/orgtype/cbe2003/129
151;;Autre forme juridique;Andere rechtsvorm;Andere Rechtsform;AFJ;AV;ARF;01/01/1800;31/12/9999;http://vocab.belgif.be/auth/orgtype/cbe2003/151
160;;Organisme public étranger ou international;Buitenlandse of internationale publieke organisatie;Ausländische oder internationale öffentliche Einrichtungen;OPEI;BIPO;AIÖE;01/01/1800;31/12/9999;http://vocab.belgif.be/auth/orgtype/cbe2003/160
200;;Société en formation;Vennootschap in oprichting;In Gründung befindliche Gesellschaft;SF;VV;GbG;01/01/1800;31/12/9999;http://vocab.belgif.be/auth/orgtype/cbe2003/200
206;;Société civile sous forme de société coopérative à responsabilité illimitée;Burgerlijke vennootschap onder vorm van coöperatieve vennootschap met onbeperkte aansprakelijkheid;Zivilrechtliche Gesellschaft in der Rechtsform einer Genossenschaft mit unbeschränkter Haftung;SC SCRI;BV CVOA;ZvGGugcH;01/01/1800;31/12/9999;http://vocab.belgif.be/auth/orgtype/cbe2003/206
208;;Société civile sous forme de société coopérative à responsabilité limitée;Burgerlijke vennootschap onder vorm van coöperatieve vennootschap met beperkte aansprakelijkheid;Zivilrechtliche Gesellschaft in der Rechtsform einer Genossenschaft mit beschränkter Haftung;SC SCRL;BV CVBA;ZvGGbH;01/01/1800;31/12/9999;http://vocab.belgif.be/auth/orgtype/cbe2003/208
211;;Société civile sous forme de société en nom collectif;Burgerlijke vennootschap onder vorm van vennootschap onder firma;Zivilrechtliche Gesellschaft in der Rechtsform einer offenen Handelsgesellschaft;SC SNC;BV VOF;ZRG OHG;01/01/1800;31/12/9999;http://vocab.belgif.be/auth/orgtype/cbe2003/211
212;;Société civile sous forme de société en commandite simple;Burgerlijke vennootschap onder vorm van gewone commanditaire vennootschap;Zivilrechtliche Gesellschaft in der Rechtsform einer einfachen Kommanditgesellschaft;SC SCS;BV GCV;ZRG EKG;01/01/1800;31/12/9999;http://vocab.belgif.be/auth/orgtype/cbe2003/212
213;;Société civile sous forme de société en commandite par actions;Burgerlijke vennootschap onder vorm van commanditaire vennootschap op aandelen;Zivilrechtliche Gesellschaft in der Rechtsform einer Kommanditgesellschaft auf Aktien;SC SCA;BV CVA;ZRG KGaA;01/01/1800;31/12/9999;http://vocab.belgif.be/auth/orgtype/cbe2003/213
214;;Société civile sous forme de société anonyme;Burgerlijke vennootschap onder vorm van naamloze vennootschap;Zivilrechtliche Gesellschaft in der Rechtsform einer Aktiengesellschaft;SC SA;BV NV;ZRG AG;01/01/1800;31/12/9999;http://vocab.belgif.be/auth/orgtype/cbe2003/214
215;;Société civile sous forme de société privée à responsabilité limitée;Burgerlijke vennootschap onder vorm van besloten vennootschap met beperkte aansprakelijkheid;Zivilrechtliche Gesellschaft in der Rechtsform einer Privatgesellschaft mit beschränkter Haftung;SC SPRL;BV BVBA;ZvGPgbH;01/01/1800;31/12/9999;http://vocab.belgif.be/auth/orgtype/cbe2003/215
225;;Société civile sous forme de société agricole;Burgerlijke Vennootschap onder vorm van Landbouwvennootschap (BV LV);Zivilrechtliche Gesellschaft in der Rechtsform einer landwirtschaftlichen Gesellschaft;SC SAGR;BV LV;ZRG LG;01/01/1800;31/12/9999;http://vocab.belgif.be/auth/orgtype/cbe2003/225
230;;Société étrangère avec un bien immobilier en Belgique (avec personnalité juridique);Buitenlandse onderneming met onroerend goed in België (met rechtspersoonlijkheid);Ausländische Gesellschaft mit einer Immobilie in Belgien (mit Rechtspersönlichkeit);SEBIBPJ;BOOGBRP;AusGmImm;01/01/1800;30/06/2003;
235;;Société étrangère sans établissement belge avec représentant responsable TVA;Buitenlandse onderneming zonder Belgische vestiging met vertegenwoordiger voor BTW;Ausländische Gesellschaft ohne Niederlassung in Belgien mit einem Fiskalvertreter für die MwSt.;SESEBTVA;BOZBVBTW;AusGohNi;01/01/1800;25/02/2004;http://vocab.belgif.be/auth/orgtype/cbe2003/235
260;;Groupement d'intérêt économique sans siège avec établissement en Belgique;Economisch samenwerkingsverband zonder zetel met vestiging in België;Wirtschaftliche Interessenvereinigung ohne Sitz mit Niederlassung in Belgien;GIE EB;ESV VB;WIV;01/01/1800;30/06/2003;
265;;Groupement européen d'intérêt économique sans siège avec établissement en Belgique;Europees economisch samenwerkingsverband zonder zetel met vestiging in België (EESV);Europäische wirtschaftliche Interessenvereinigung ohne Sitz mit Niederlassung in Belgien (EWIV);GEIE EB;EESV VB;EWIV;01/01/1800;31/12/9999;http://vocab.belgif.be/auth/orgtype/cbe2003/265
301;;Service public fédéral;Federale overheidsdienst;Föderaler öffentlicher Dienst;SPF;FOD;FÖD;01/01/1800;31/12/9999;http://vocab.belgif.be/auth/orgtype/cbe2003/301
302;;Service public fédéral de programmation;Programmatorische federale overheidsdienst;Föderaler öffentlicher Programmierungsdienst;SPP;POD;FÖP;01/01/1800;31/12/9999;http://vocab.belgif.be/auth/orgtype/cbe2003/302
303;;Autre service fédéral;Andere federale dienst;Anderer föderale Dienst;SERVFEDE;FEDEDIEN;FödD;01/01/1800;31/12/9999;http://vocab.belgif.be/auth/orgtype/cbe2003/303
310;;Autorité de la Région flamande et de la Communauté flamande;Overheid van het Vlaamse Gewest en van de Vlaamse Gemeenschap;Behörde der Flämischen Region und der Flämischen Gemeinschaft;REGCOMNL;VLGEWGEM;FlRG;01/01/1800;31/12/9999;http://vocab.belgif.be/auth/orgtype/cbe2003/310
320;;Autorité de la Région wallonne;Overheid van het Waalse Gewest;Behörde der Wallonischen Region;RW;WG;WR;01/01/1800;31/12/9999;http://vocab.belgif.be/auth/orgtype/cbe2003/320
330;;Autorité de la Région de Bruxelles-Capitale;Overheid van het Brusselse Hoofdstedelijk Gewest;Behörde der Region Brüssel-Hauptstadt;REGBRXCA;BRUHOOGE;RBH;01/01/1800;31/12/9999;http://vocab.belgif.be/auth/orgtype/cbe2003/330
340;;Autorité de la Communauté française;Overheid van de Franse Gemeenschap;Behörde der Französischen Gemeinschaft;COMMFRAN;FRAGEMEE;FrG;01/01/1800;31/12/9999;http://vocab.belgif.be/auth/orgtype/cbe2003/340
350;;Autorité de la Communauté germanophone;Overheid van de Duitstalige Gemeenschap;Behörde der Deutschsprachigen Gemeinschaft;COMGERMA;DUITGEME;DG;01/01/1800;31/12/9999;http://vocab.belgif.be/auth/orgtype/cbe2003/350
370;;Ministère des Affaires économiques;Ministerie van Economische Zaken;Ministerium der Wirtschaftsangelegenheiten;AFFECO;ECOZAKEN;MWA;01/01/1800;30/06/2003;
371;;Ministère des Affaires étrangères, Commerce extérieur et Coopération au Développement;Ministerie van Buitenlandse Zaken, Buitenlandse handel en Ontwikkelingssamenwerking;Ministerium der Auswärtigen Angelegenheiten, des Außenhandels und der Entwicklungszusammenarbeit;AE;BZ;MAA;01/01/1800;30/06/2003;
372;;Ministère de l'Agriculture;Ministerie van Landbouw;Ministerium der Landwirtschaft;MINAGRI.;LANDMIN;ML;01/01/1800;30/06/2003;
373;;Ministère des Classes moyennes;Ministerie van Middenstand;Ministerium des Mittelstands;MOYENNES;MIDDENST;MnMittel;01/01/1800;30/06/2003;
374;;Ministère des Communications;Ministerie van Verkeerswerken;Ministerium des Verkehrswesens;MINCOMM;VERKEER;MV;01/01/1800;30/06/2003;
375;;Ministère de la Défense;Ministerie van Defensie;Verteidigungsministerium;MD;MD;VM;01/01/1800;30/06/2003;
376;;Ministère de l'Éducation nationale et de la Culture;Ministerie van Nationale Opvoeding en Cultuur;Ministerium des Unterrichtswesens und der Kultur;MENC;MNOC;MUK;01/01/1800;30/06/2003;
377;;Ministère de l'Emploi et du Travail;Ministerie van Tewerkstelling en Arbeid;Ministerium der Beschäftigung und der Arbeit;MET;MTA;MBA;01/01/1800;30/06/2003;
378;;Ministère des Finances;Ministerie van Financiën;Ministerium der Finanzen;MINFIN;MINFIN;MF;01/01/1800;30/06/2003;
379;;Ministère de l'Intérieur;Ministerie van Binnenlandse Zaken;Ministerium des Innern;MININT;MBZ;MI;01/01/1800;30/06/2003;
380;;Ministère de la Justice;Ministerie van Justitie;Ministerium der Justiz;MINJUST;MINJUST;MJ;01/01/1800;30/06/2003;
381;;Ministère de la Prévoyance sociale;Ministerie van Sociale Voorzorg;Ministerium der Sozialfürsorge;MPS;MSV;MS;01/01/1800;30/06/2003;
382;;Ministère de la Santé publique et de la Famille;Ministerie van Volksgezondheid en Gezin;Ministerium der Volksgesundheit und der Familie;MSPF;MVG;MVF;01/01/1800;30/06/2003;
383;;Services du Premier Ministre;Diensten van de Eerste Minister;Dienststellen des Premierministers;FIRSTMIN;FIRSTMIN;DnstPrem;01/01/1800;30/06/2003;
384;;Ministère des Communications et de l'Infrastructure;Ministerie van Verkeer en Infrastructuur;Ministerium des Verkehrswesens und der Infrastruktur;MCI;MVI;MVI;01/01/1800;30/06/2003;
385;;Ministère de la Communauté flamande;Ministerie van de Vlaamse Gemeenschap;Ministerium der Flämischen Gemeinschaft;MCF;MVG;MFlG;01/01/1800;30/06/2003;
386;;Ministère de la Communauté française;Ministerie van de Franse Gemeenschap;Ministerium der Französischen Gemeinschaft;MCF;MFG;MFrG;01/01/1800;30/06/2003;
387;;Ministère de la Région de Bruxelles-Capitale;Ministerie van het Brusselse Hoofdstedelijk Gewest;Ministerium der Region Brüssel-Hauptstadt;MRBC;MBHG;MRBH;01/01/1800;30/06/2003;
388;;Ministère de la Région wallonne;Ministerie van het Waalse Gewest;Ministerium der Wallonischen Region;MRW;MWG;MWR;01/01/1800;30/06/2003;
389;;Ministère de la Communauté germanophone;Ministerie van de Duitstalige Gemeenschap;Ministerium der Deutschsprachigen Gemeinschaft;MCG;MDG;MDG;01/01/1800;30/06/2003;
390;;Ministère de la Fonction publique;Ministerie van Ambtenarenzaken;Ministerium des Öffentlichen Dienstes;MFP;MAZ;MÖD;01/01/1800;30/06/2003;
391;;Ministère des Classes moyennes et de l'Agriculture;Ministerie van Middenstand en Landbouw;Ministerium des Mittelstands und der Landwirtschaft;MCMA;MML;MML;01/01/1800;30/06/2003;
392;;Ministère des Affaires sociales, de la Santé publique et de l'Environnement;Ministerie van Sociale Zaken, Volksgezondheid en Leefmilieu;Ministerium der Sozialen Angelegenheiten, der Volksgesundheit und der Umwelt;MASSPE;MSZVL;MSAVU;01/01/1800;30/06/2003;
393;;Divers;Andere;Sonstige;DIVERS;ANDERE;Sonstige;01/01/1800;30/06/2003;
400;;Autorité provinciale;Provinciale overheid;Provinzialbehörde;AUTOPROV;PROVOVER;Provbehö;01/01/1800;31/12/9999;http://vocab.belgif.be/auth/orgtype/cbe2003/400
401;;Organisme immatriculé par l'ONSS-APL;Organisme ingeschreven door de RSZ PPO;Vom LASSPLV eingetragene Stelle;ORGAPL;ORG PPO;St. PLV;01/01/1800;31/12/2006;http://vocab.belgif.be/auth/orgtype/cbe2003/401
411;;Ville / commune;Stad / gemeente;Stadt / Gemeinde;COMMUNES;GEMEENTE;Gemeinde;01/01/1800;31/12/9999;http://vocab.belgif.be/auth/orgtype/cbe2003/411
412;;Centre public d'action sociale;Openbaar centrum voor maatschappelijk welzijn;Öffentliches Sozialhilfezentrum;CPAS;OCMW;ÖSHZ;01/01/1800;31/12/9999;http://vocab.belgif.be/auth/orgtype/cbe2003/412
413;;Police locale;Lokale politiezone;Lokale Polizeizone;POLLOC;LOKPOL;LP;01/01/1800;31/12/9999;http://vocab.belgif.be/auth/orgtype/cbe2003/413
414;;Intercommunale;Intercommunale;Interkommunale;IC;IC;IK;01/01/1800;31/12/9999;http://vocab.belgif.be/auth/orgtype/cbe2003/414
415;;Association de projet;Projectvereniging;Projektvereinigung;APROJ;PROJ V;Prjverng;01/01/1800;31/12/9999;http://vocab.belgif.be/auth/orgtype/cbe2003/415
416;;Association prestataire de services (Région flamande);Dienstverlenende vereniging (Vlaams Gewest);Dienstleistungsvereinigung (Flämische Region);ASS SERV;DIENSTV;DlvFL;01/01/1800;31/12/9999;http://vocab.belgif.be/auth/orgtype/cbe2003/416
417;;Association chargée de mission (Région flamande);Opdrachthoudende vereniging (Vlaams Gewest);Beauftragte Vereinigung (Flämische Region);ACMISS;OPDRAVER;BVerFL;01/01/1800;31/12/9999;http://vocab.belgif.be/auth/orgtype/cbe2003/417
418;;Régie communale autonome;Autonoom gemeentebedrijf;Autonome Gemeinderegie;RCOMAUT;AUTOGEMB;AutGemRg;01/01/1800;31/12/9999;http://vocab.belgif.be/auth/orgtype/cbe2003/418
419;;Régie provinciale autonome;Autonoom provinciebedrijf;Autonome Provinzialregie;RPROVAUT;AUTOPRB;AutPrvRg;01/01/1800;31/12/9999;http://vocab.belgif.be/auth/orgtype/cbe2003/419
420;;Association de CPAS;Vereniging van OCMW's;Vereinigung von öffentlichen Sozialhilfezentren;Ass.CPAS;Ver.OCMW;VÖSHZ;01/01/1800;31/12/9999;http://vocab.belgif.be/auth/orgtype/cbe2003/420
451;;Organismes immatriculés pour l'O.N.P.;Organismen ingeschreven voorde R.V.P.;Beim LPA eingetragene Stellen;ONP;RVP;LPA;01/01/1800;30/06/2003;
452;;Organisme immatriculé pour l'Administration des Pensions;Organisme ingeschreven voor de Administratie van de Pensioenen;Bei der Verwaltung der Pensionen eingetragene Stelle;OIAP;OIAP;VPeSt.;01/01/1800;30/06/2003;
453;;Société étrangère sans établissement belge cotée en bourse;Buitenlandse onderneming zonder Belgische vestiging genoteerd op de beurs;Börsennotierte ausländische Gesellschaft ohne Niederlassung in Belgien;SESEBCB;BOZBVGB;BnausGoN;01/01/1800;30/06/2003;
454;;Société étrangère avec un bien immobilier en Belgique (sans personnalité juridique);Buitenlandse onderneming met onroerend goed in België (zonder rechtspersoonlijkheid);Ausländische Gesellschaft mit einer Immobilie in Belgien (ohne Rechtspersönlichkeit);SEBIBE;BOOGBE;AusGmImm;01/01/1800;30/06/2003;
506;;Société coopérative à responsabilité illimitée à finalité sociale;Coöperatieve vennootschap met onbeperkte aansprakelijkheid met een sociaal oogmerk;Genossenschaft mit unbeschränkter Haftung mit sozialer Zielsetzung;SCRI FS;CVOA SO;GuHsZ;01/01/1800;31/12/9999;http://vocab.belgif.be/auth/orgtype/cbe2003/506
508;;Société coopérative à responsabilité limitée à finalité sociale;Coöperatieve vennootschap met beperkte aansprakelijkheid met een sociaal oogmerk;Genossenschaft mit beschränkter Haftung mit sozialer Zielsetzung;SCRL FS;CVBA SO;GbHsZ;01/01/1800;31/12/9999;http://vocab.belgif.be/auth/orgtype/cbe2003/508
510;;Société privée à responsabilité limitée unipersonnelle à finalité sociale;Eenpersoons besloten vennootschap met beperkte aansprakelijkheid met een sociaal oogmerk;Privatgesellschaft mit beschränkter Haftung mit sozialer Zielsetzung mit einem Alleingesellschafter;SPRLU FS;EBVBA SO;PgbHsZ;01/01/1800;28/02/2004;http://vocab.belgif.be/auth/orgtype/cbe2003/510
511;;Société en nom collectif à finalité sociale;Vennootschap onder firma met een sociaal oogmerk;Offene Handelsgesellschaft mit sozialer Zielsetzung;SNC FS;VOF SO;OHGmsZ;01/01/1800;31/12/9999;http://vocab.belgif.be/auth/orgtype/cbe2003/511
512;;Société en commandite simple à finalité sociale;Gewone commanditaire vennootschap met een sociaal oogmerk;Einfache Kommanditgesellschaft mit sozialer Zielsetzung;SCS FS;GCW SO;EKGmsZ;01/01/1800;31/12/9999;http://vocab.belgif.be/auth/orgtype/cbe2003/512
513;;Société en commandite par actions à finalité sociale;Commanditaire vennootschap op aandelen met een sociaal oogmerk;Kommanditgesellschaft auf Aktien mit sozialer Zielsetzung;SCA FS;CVA SO;KGaAmsZ;01/01/1800;31/12/9999;http://vocab.belgif.be/auth/orgtype/cbe2003/513
514;;Société anonyme à finalité sociale;Naamloze vennootschap met een sociaal oogmerk;Aktiengesellschaft mit sozialer Zielsetzung;SA FS;NV SO;AGmsZ;01/01/1800;31/12/9999;http://vocab.belgif.be/auth/orgtype/cbe2003/514
515;;Société privée à responsabilité limitée à finalité sociale;Besloten vennootschap met beperkte aansprakelijkheid met een sociaal oogmerk;Privatgesellschaft mit beschränkter Haftung mit sozialer Zielsetzung;SPRL FS;BVBA SO;PmbHsZ;01/01/1800;31/12/9999;http://vocab.belgif.be/auth/orgtype/cbe2003/515
560;;Groupement d'intérêt économique à finalité sociale;Economisch samenwerkingsverband met een sociaal oogmerk;Wirtschaftliche Interessenvereinigung mit sozialer Zielsetzung;GIE FS;ESV SO;WIVmsZ;01/01/1800;31/12/9999;http://vocab.belgif.be/auth/orgtype/cbe2003/560
606;;Société coopérative à responsabilité illimitée et à finalité sociale;Coöperatieve vennootschap met onbeperkte aansprakelijkheid met een sociaal oogmerk;Genossenschaft mit unbeschränkter Haftung mit sozialer Zielsetzung;SCRI FS;CVOA SO;GuHsZöfr;01/01/1800;23/04/2004;http://vocab.belgif.be/auth/orgtype/cbe2003/606
608;;Société coopérative à responsabilité limitée à finalité sociale;Coöperatieve vennootschap met beperkte aansprakelijkheid met een sociaal oogmerk;Genossenschaft mit beschränkter Haftung mit sozialer Zielsetzung;SCRL FS;CVBA SO;GbHsZör;01/01/1800;23/04/2004;http://vocab.belgif.be/auth/orgtype/cbe2003/608
