code;parent;fr;nl
85.50;85;Octrois de crédits à d'autres groupes institutionnels;Kredietverleningen aan andere institutionele groepen 
85.6;85;Prises de participations à l'intérieur des administrations publiques;Deelnemingen binnen de overheidssector
85.61;85;À l'intérieur du groupe institutionnel;Binnen de institutionele groep 
85.62;85;Sécurité sociale;Sociale zekerheid
85.63;85;Pouvoirs locaux;Lokale overheden
85.64;85;Enseignement autonome subsidié;Gesubsidieerd autonoom onderwijs
85.65;85;Autres groupes institutionnels;Andere institutionele groepen
85.7;85;Avances à l'intérieur du secteur des administrations publiques;Voorschotten binnen de overheidssector
85.71;85;À l'intérieur du groupe institutionnel;Binnen de institutionele groep 
85.72;85;Sécurité sociale;Sociale zekerheid
85.73;85;Pouvoirs locaux;Lokale overheden
85.74;85;Enseignement autonome subsidié;Gesubsidieerd autonoom onderwijs
85.75;85;Autres groupes institutionnels;Andere institutionele groepen
86;8;"Remboursements de crédits par et liquidations de participations dans les entreprises et institutions financières;autres produits financiers et avances";Kredietaflossingen door, vereffeningen van deelnemingen in bedrijven en financiële instellingen, andere financiële producten en terugbetaling van voorschotten
86.10;86;Remboursements de crédits par les entreprises;Kredietaflossingen door bedrijven
86.20;86;Remboursements de crédits par les institutions de crédit;Kredietaflossingen door kredietinstellingen
86.30;86;Remboursements de crédits par les sociétés d'assurance;Kredietaflossingen door verzekeringsmaatschappijen
86.40;86;Liquidations de participations dans les entreprises;Vereffeningen van deelnemingen in bedrijven
86.50;86;Liquidations de participations dans les institutions de crédit;Vereffeningen van deelnemingen in kredietinstellingen
86.60;86;Liquidations de participations dans les sociétés d'assurance;Vereffeningen van deelnemingen in verzekeringsmaatschappijen
86.70;86;Autres produits financiers;Andere financiële producten 
86.80;86;Remboursements d'avances par les entreprises et institutions financières;Terugbetaling van voorschotten door bedrijven en financiële instellingen
87;8;Remboursements de crédits et d'avances par les ASBL au service des ménages et par les ménages;Kredietaflossingen en terugbetaling van voorschotten door vzw's ten behoeve van de gezinnen en door gezinnen
87.10;87;Remboursements de crédits par les ASBL au service des ménages;Kredietaflossingen door vzw's ten behoeve van de gezinnen
87.20;87;Remboursements de crédits par les ménages;Kredietaflossingen door gezinnen
87.30;87;Remboursements d'avances par les ASBL au service des ménages;Terugbetaling van voorschotten door vzw's ten behoeve van de gezinnen
87.40;87;Remboursements d'avances par les ménages;Terugbetaling van voorschotten door de gezinnen
88;8;Remboursements de crédits, d'avances  et liquidations de participations par l'étranger;Kredietaflossingen door, terugbetaling van voorschotten en vereffeningen van deelnemingen in het buitenland
88.1;88;Remboursements de crédits par l'étranger;Kredietaflossingen door het buitenland
88.11;88;Par les institutions de l'UE;Door EU-instellingen
88.12;88;Par les pays membres de l'UE (administrations publiques);Door lidstaten van de EU (overheden)
88.13;88;Par les pays membres de l'UE (non-administrations publiques);Door lidstaten van de EU (niet-overheden)
88.14;88;Par des institutions internationales autres que les institutions de l'UE;Door internationale instellingen andere dan de EU-instellingen
88.15;88;Par des pays autres que les pays membres de l'UE (administrations publiques);Door landen andere dan de lidstaten van de EU (overheden)
88.16;88;Par des pays autres que les pays membres de l'UE (non-administrations publiques);Door landen andere dan de lidstaten van de EU (niet-overheden)
88.17;88;Remboursement de l'UE dans le cadre de dépenses préfinancées par l'entité;Terugbetaling van de EU in het kader van uitgaven geprefinancierd door de entiteit
88.2;88;Liquidations de participations à l'étranger;Vereffeningen van deelnemingen in het buitenland
88.21;88;Dans des institutions de l'UE;In EU-instellingen
88.22;88;Dans des pays membres de l'UE (non-administrations publiques);In lidstaten van de EU (niet-overheden)
88.23;88;Dans des institutions internationales autres que les institutions de l'UE;In internationale instellingen andere dan de EU-instellingen
88.24;88;Dans des pays autres que les pays membres de l'UE (non-administrations publiques);In landen andere dan de lidstaten van de EU (niet-overheden)
88.3;88;Remboursements d'avances par l'étranger;Terugbetaling van voorschotten door het buitenland
88.30;88;Remboursements d'avances par l'étranger;Terugbetaling van voorschotten door het buitenland
89;8;Remboursements de crédits, d'avances et liquidations de participations à l'intérieur du secteur des administrations publiques;Kredietaflossingen, terugbetaling van voorschotten en vereffeningen van deelnemingen binnen de overheidssector
89.1;89;Remboursements de crédits à l'intérieur d'un groupe institutionnel;Kredietaflossingen binnen een institutionele groep
89.11;89;Du pouvoir institutionnel;Van de institutionele overheid
89.12;89;Des fonds budgétaires non organiques;Van niet-organieke begrotingsfondsen
89.13;89;Des services administratifs à comptabilité autonome (SACA);Van administratieve diensten met boekhoudkundige autonomie (ADBA)
89.14;89;Des organismes administratifs publics (OAP);Van administratieve openbare instellingen (AOI)
89.15;89;Des établissements d'enseignement du pouvoir institutionnel;Van onderwijsinstellingen van de institutionele overheid
89.16;89;Des ASBL des administrations publiques;Van vzw's van de overheid
89.17;89;Des autres unités publiques;Van andere eenheden van de overheid
89.2;89;Remboursements de crédits par les administrations de sécurité sociale;Kredietaflossingen door de socialezekerheidsinstellingen
89.20;89;Remboursements de crédits par les administrations de sécurité sociale;Kredietaflossingen door de socialezekerheidsinstellingen
89.3;89;Remboursements de crédits par les administrations publiques locales;Kredietaflossingen door lokale overheden
89.31;89;Par les provinces;Door provincies
89.32;89;Par les communes;Door gemeenten
89.33;89;Non utilisé;Niet gebruikt
89.34;89;Par les ASBL des pouvoirs locaux;Door vzw's van de lokale overheden
89.35;89;Par les autres administrations publiques locales;Door overige lokale overheden
89.4;89;Remboursements de crédits par l'enseignement autonome subsidié;Kredietaflossingen door het gesubsidieerd autonoom onderwijs
89.40;89;Remboursements de crédits par l'enseignement autonome subsidié;Kredietaflossingen door het gesubsidieerd autonoom onderwijs
89.5;89;Remboursements de crédits par d'autres groupes institutionnels;Kredietaflossingen door andere institutionele groepen
89.50;89;Remboursements de crédits par d'autres groupes institutionnels;Kredietaflossingen door andere institutionele groepen 
89.6;89;Liquidations de participations à l'intérieur du secteur des administrations publiques;Vereffeningen van deelnemingen binnen de overheidssector
89.61;89;À l'intérieur du groupe institutionnel;Binnen de institutionele groep 
89.62;89;Sécurité sociale;Sociale zekerheid
89.63;89;Pouvoirs locaux;Lokale overheden
89.64;89;Enseignement autonome subsidié;Gesubsidieerd autonoom onderwijs
89.65;89;Autres groupes institutionnels;Andere institutionele groepen
89.7;89;Remboursements d'avances à l'intérieur du secteur des administrations publiques;Terugbetaling van voorschotten binnen de overheidssector
89.71;89;À l'intérieur du groupe institutionnel;Binnen de institutionele groep 
89.72;89;Sécurité sociale;Sociale zekerheid
89.73;89;Pouvoirs locaux;Lokale overheden
89.74;89;Enseignement autonome subsidié;Gesubsidieerd autonoom onderwijs
89.75;89;Autres groupes institutionnels;Andere institutionele groepen
9;;DETTE PUBLIQUE;OVERHEIDSSCHULD
91;9;Remboursements d'emprunts émis à plus d'un an;Aflossingen van leningen met een looptijd van meer dan één jaar
91.10;91;Remboursements de la dette en euros;Aflossingen van de schuld in euro
91.20;91;Remboursements de la dette en monnaies étrangères;Aflossingen van de schuld in vreemde valuta
91.3;91;Remboursements de la dette à l'intérieur du secteur des administrations publiques;Aflossingen van de schuld binnen de overheidssector
91.30;91;Remboursements de la dette à l'intérieur du secteur des administrations publiques (non ventilé);Aflossingen van de schuld binnen de overheidssector (niet verdeeld)
91.31;91;A l'intérieur du groupe institutionnel;Binnen de institutionele groep 
91.32;91;A la sécurité sociale;Aan de sociale zekerheid
91.33;91;Aux pouvoirs locaux;Aan de lokale overheden
91.34;91;A l'enseignement autonome subsidié;Aan het gesubsidieerd autonoom onderwijs
91.35;91;Aux autres groupes institutionnels;Aan andere institutionele groepen
91.4;91;Remboursements des préfinancements de l'UE;Terugbetaling van prefinancieringen van de EU
91.40;91;Remboursements des préfinancements de l'UE;Terugbetaling van prefinancieringen van de EU
91.7;91;Amortissements sur leasings financiers;Aflossingen bij financiële leasings
91.70;91;Amortissements sur leasings financiers;Aflossingen bij financiële leasings
92;9;Démonétisations;Ontmuntingen(thans niet in gebruik)
92.00;92;Démonétisations;Ontmuntingen(thans niet in gebruik)
93;9;Réduction de fonds propres;Verlaging van het eigen vermogen
93.00;93;Réduction de fonds propres;Verlaging van het eigen vermogen
94;9;Remboursements d'avances;Terugbetaling van voorschotten
94.00;94;Remboursements d'avances;Terugbetaling van voorschotten
96;9;Produits des emprunts émis à plus d'un an;Opbrengst van leningen met een looptijd van meer dan één jaar
96.10;96;Produits des emprunts en euros;Opbrengst van leningen in euro
96.20;96;Produits des emprunts en monnaies étrangères;Opbrengst van leningen in vreemde valuta
96.3;96;Produits des emprunts à l'intérieur du secteur des administrations publiques;Opbrengst van leningen binnen de overheidssector
96.30;96;Produits des emprunts à l'intérieur du secteur des administrations publiques (non ventilé);Opbrengst van leningen binnen de overheidssector (niet verdeeld)
96.31;96;A l'intérieur du groupe institutionnel;Binnen de institutionele groep 
96.32;96;De la sécurité sociale;Van de sociale zekerheid
96.33;96;Des pouvoirs locaux;Van de lokale overheden
96.34;96;De l'enseignement autonome subsidié;Van het gesubsidieerd autonoom onderwijs
96.35;96;Des autres groupes institutionnels;Van andere institutionele groepen
96.4;96;Préfinancement par l'UE des dépenses financées par l'UE;Prefinanciering door de EU van door Europese subsidies gefinancierde uitgaven 
96.40;96;Préfinancement par l'UE des dépenses financées par l'UE;Prefinanciering door de EU van door Europese subsidies gefinancierde uitgaven 
96.7;96;Produits des emprunts en matière de leasings financiers;Opbrengst van leningen inzake financiële leasings
96.70;96;Produits des emprunts en matière de leasings financiers;Opbrengst van leningen inzake financiële leasings
97;9;Monétisations;Aanmuntingen(thans niet in gebruik)
97.00;97;Monétisations;Aanmuntingen(thans niet in gebruik)
98;9;Apport de fonds propres;Verhoging van het eigen vermogen
98.00;98;Apport de fonds propres;Verhoging van het eigen vermogen
99;9;Produit des avances;Opbrengst van voorschotten
99.00;99;Produit des avances;Opbrengst van voorschotten
